{"depth_of_field":{"anamorphic_ratio":1,"aperture_blades":7,"aperture_rotation_rad":0,"enabled":false,"f_stop":2.8,"focus_distance_m":5},"id":"optics","kind":"camera3d-optics","projection":{"far_clip_m":100,"focal_length_mm":50,"near_clip_m":0.1,"sensor_fit":"horizontal","sensor_height_mm":24,"sensor_width_mm":36,"shift_x":0,"shift_y":0,"type":"perspective"},"schema_version":1,"version":"1.0.0"}
